{
  "schema_version": 1,
  "event_type": "run.completed",
  "run_id": "schema_fixture",
  "elapsed_ms": 120,
  "summary": {
    "requested_concurrency": 1,
    "active_count": 0,
    "completed_count": 1,
    "failed_count": 0,
    "wall_time_ms": 120,
    "total_completion_tokens": 1,
    "aggregate_decode_tok_s": 8.333,
    "ttft_ms": 32,
    "completion_count": 1,
    "throughput_distribution": [
      {
        "stream_index": 0,
        "completion_tokens": 1,
        "wall_time_ms": 90,
        "tok_s": 11.111,
        "status": "success",
        "ttft_ms": 32,
        "failure_kind": null
      }
    ],
    "failure_labels": [],
    "winning_recipe": "fixture"
  }
}
